{
  "authority": {
    "consensus_is_evidence": false,
    "decision_authority": "human-only",
    "notice": "Multi-model consensus is a diagnostic stress-test result, not scholarly evidence, validation, or authority to alter accepted annotations."
  },
  "case_id": "lincoln",
  "generator": "scripts/model_reliability/generate_consensus_report.py",
  "limitations": [
    "Consensus may reflect shared model bias or shared prompt effects.",
    "Reference support is diagnostic alignment, not independent evidence.",
    "Reference challenges require human source and codebook review.",
    "Undefined or sparse metrics are reported as insufficient data.",
    "Invalid submissions remain visible but are not pooled into agreement metrics."
  ],
  "model_stability": [
    {
      "case_id": "lincoln",
      "comparable_count": 7,
      "defined_pair_count": 1,
      "field": "cmt.cluster_id",
      "maximum_agreement": 1.0,
      "minimum_agreement": 1.0,
      "pair_count": 1,
      "source_language": "en",
      "status": "stable",
      "task_layer": "cmt"
    },
    {
      "case_id": "lincoln",
      "comparable_count": 7,
      "defined_pair_count": 1,
      "field": "cmt.conceptual_metaphor",
      "maximum_agreement": 0.0,
      "minimum_agreement": 0.0,
      "pair_count": 1,
      "source_language": "en",
      "status": "unstable",
      "task_layer": "cmt"
    },
    {
      "case_id": "lincoln",
      "comparable_count": 7,
      "defined_pair_count": 1,
      "field": "cmt.entailments",
      "maximum_agreement": 0.0,
      "minimum_agreement": 0.0,
      "pair_count": 1,
      "source_language": "en",
      "status": "unstable",
      "task_layer": "cmt"
    },
    {
      "case_id": "lincoln",
      "comparable_count": 7,
      "defined_pair_count": 1,
      "field": "cmt.source_domain_primary",
      "maximum_agreement": 0.7142857142857143,
      "minimum_agreement": 0.7142857142857143,
      "pair_count": 1,
      "source_language": "en",
      "status": "unstable",
      "task_layer": "cmt"
    },
    {
      "case_id": "lincoln",
      "comparable_count": 7,
      "defined_pair_count": 1,
      "field": "cmt.source_domain_secondary",
      "maximum_agreement": 0.34523809523809523,
      "minimum_agreement": 0.34523809523809523,
      "pair_count": 1,
      "source_language": "en",
      "status": "unstable",
      "task_layer": "cmt"
    },
    {
      "case_id": "lincoln",
      "comparable_count": 7,
      "defined_pair_count": 1,
      "field": "cmt.target_domain",
      "maximum_agreement": 0.7142857142857143,
      "minimum_agreement": 0.7142857142857143,
      "pair_count": 1,
      "source_language": "en",
      "status": "unstable",
      "task_layer": "cmt"
    },
    {
      "case_id": "lincoln",
      "comparable_count": 7,
      "defined_pair_count": 1,
      "field": "confidence",
      "maximum_agreement": 0.07142857142857144,
      "minimum_agreement": 0.07142857142857144,
      "pair_count": 1,
      "source_language": "en",
      "status": "unstable",
      "task_layer": "cmt"
    },
    {
      "case_id": "lincoln",
      "comparable_count": 7,
      "defined_pair_count": 1,
      "field": "uncertainty.status",
      "maximum_agreement": 0.8571428571428571,
      "minimum_agreement": 0.8571428571428571,
      "pair_count": 1,
      "source_language": "en",
      "status": "unstable",
      "task_layer": "cmt"
    },
    {
      "case_id": "lincoln",
      "comparable_count": 0,
      "defined_pair_count": 0,
      "field": "confidence",
      "maximum_agreement": null,
      "minimum_agreement": null,
      "pair_count": 1,
      "source_language": "en",
      "status": "insufficient-data",
      "task_layer": "identification"
    },
    {
      "case_id": "lincoln",
      "comparable_count": 0,
      "defined_pair_count": 0,
      "field": "identification.basic_meaning",
      "maximum_agreement": null,
      "minimum_agreement": null,
      "pair_count": 1,
      "source_language": "en",
      "status": "insufficient-data",
      "task_layer": "identification"
    },
    {
      "case_id": "lincoln",
      "comparable_count": 0,
      "defined_pair_count": 0,
      "field": "identification.boundary_decision",
      "maximum_agreement": null,
      "minimum_agreement": null,
      "pair_count": 1,
      "source_language": "en",
      "status": "insufficient-data",
      "task_layer": "identification"
    },
    {
      "case_id": "lincoln",
      "comparable_count": 0,
      "defined_pair_count": 0,
      "field": "identification.boundary_span",
      "maximum_agreement": null,
      "minimum_agreement": null,
      "pair_count": 1,
      "source_language": "en",
      "status": "insufficient-data",
      "task_layer": "identification"
    },
    {
      "case_id": "lincoln",
      "comparable_count": 0,
      "defined_pair_count": 0,
      "field": "identification.comparison_basis",
      "maximum_agreement": null,
      "minimum_agreement": null,
      "pair_count": 1,
      "source_language": "en",
      "status": "insufficient-data",
      "task_layer": "identification"
    },
    {
      "case_id": "lincoln",
      "comparable_count": 0,
      "defined_pair_count": 0,
      "field": "identification.contextual_meaning",
      "maximum_agreement": null,
      "minimum_agreement": null,
      "pair_count": 1,
      "source_language": "en",
      "status": "insufficient-data",
      "task_layer": "identification"
    },
    {
      "case_id": "lincoln",
      "comparable_count": 0,
      "defined_pair_count": 0,
      "field": "identification.contrast_explanation",
      "maximum_agreement": null,
      "minimum_agreement": null,
      "pair_count": 1,
      "source_language": "en",
      "status": "insufficient-data",
      "task_layer": "identification"
    },
    {
      "case_id": "lincoln",
      "comparable_count": 0,
      "defined_pair_count": 0,
      "field": "identification.decision",
      "maximum_agreement": null,
      "minimum_agreement": null,
      "pair_count": 1,
      "source_language": "en",
      "status": "insufficient-data",
      "task_layer": "identification"
    },
    {
      "case_id": "lincoln",
      "comparable_count": 0,
      "defined_pair_count": 0,
      "field": "uncertainty.status",
      "maximum_agreement": null,
      "minimum_agreement": null,
      "pair_count": 1,
      "source_language": "en",
      "status": "insufficient-data",
      "task_layer": "identification"
    },
    {
      "case_id": "lincoln",
      "comparable_count": 0,
      "defined_pair_count": 0,
      "field": "confidence",
      "maximum_agreement": null,
      "minimum_agreement": null,
      "pair_count": 1,
      "source_language": "en",
      "status": "insufficient-data",
      "task_layer": "interpretation"
    },
    {
      "case_id": "lincoln",
      "comparable_count": 0,
      "defined_pair_count": 0,
      "field": "interpretation.absence.displacement_mechanism",
      "maximum_agreement": null,
      "minimum_agreement": null,
      "pair_count": 1,
      "source_language": "en",
      "status": "insufficient-data",
      "task_layer": "interpretation"
    },
    {
      "case_id": "lincoln",
      "comparable_count": 0,
      "defined_pair_count": 0,
      "field": "interpretation.absence.expected_presence",
      "maximum_agreement": null,
      "minimum_agreement": null,
      "pair_count": 1,
      "source_language": "en",
      "status": "insufficient-data",
      "task_layer": "interpretation"
    },
    {
      "case_id": "lincoln",
      "comparable_count": 0,
      "defined_pair_count": 0,
      "field": "interpretation.absence.possible_absence",
      "maximum_agreement": null,
      "minimum_agreement": null,
      "pair_count": 1,
      "source_language": "en",
      "status": "insufficient-data",
      "task_layer": "interpretation"
    },
    {
      "case_id": "lincoln",
      "comparable_count": 0,
      "defined_pair_count": 0,
      "field": "interpretation.absence.status",
      "maximum_agreement": null,
      "minimum_agreement": null,
      "pair_count": 1,
      "source_language": "en",
      "status": "insufficient-data",
      "task_layer": "interpretation"
    },
    {
      "case_id": "lincoln",
      "comparable_count": 0,
      "defined_pair_count": 0,
      "field": "interpretation.agency.agents",
      "maximum_agreement": null,
      "minimum_agreement": null,
      "pair_count": 1,
      "source_language": "en",
      "status": "insufficient-data",
      "task_layer": "interpretation"
    },
    {
      "case_id": "lincoln",
      "comparable_count": 0,
      "defined_pair_count": 0,
      "field": "interpretation.agency.beneficiaries",
      "maximum_agreement": null,
      "minimum_agreement": null,
      "pair_count": 1,
      "source_language": "en",
      "status": "insufficient-data",
      "task_layer": "interpretation"
    },
    {
      "case_id": "lincoln",
      "comparable_count": 0,
      "defined_pair_count": 0,
      "field": "interpretation.agency.excluded_agents",
      "maximum_agreement": null,
      "minimum_agreement": null,
      "pair_count": 1,
      "source_language": "en",
      "status": "insufficient-data",
      "task_layer": "interpretation"
    },
    {
      "case_id": "lincoln",
      "comparable_count": 0,
      "defined_pair_count": 0,
      "field": "interpretation.agency.patients",
      "maximum_agreement": null,
      "minimum_agreement": null,
      "pair_count": 1,
      "source_language": "en",
      "status": "insufficient-data",
      "task_layer": "interpretation"
    },
    {
      "case_id": "lincoln",
      "comparable_count": 0,
      "defined_pair_count": 0,
      "field": "interpretation.agency.sacrificial_subjects",
      "maximum_agreement": null,
      "minimum_agreement": null,
      "pair_count": 1,
      "source_language": "en",
      "status": "insufficient-data",
      "task_layer": "interpretation"
    },
    {
      "case_id": "lincoln",